{
  "report_title_zh": "竞品分析 Prompt 评测",
  "original_prompt": "帮我全面分析一下 A 和 B 两个竞品，写得专业一点。",
  "classification": {
    "primary_type": "comparison_task",
    "primary_type_zh": "对比型",
    "secondary_type": "generation_task",
    "secondary_type_zh": "生成型",
    "confidence": 0.94,
    "confidence_zh": "高",
    "rationale_zh": "核心工作是把 A、B 两个对象放在统一维度下比较；最终需要形成文档，因此带有次要的生成型特征。"
  },
  "node_coverage": [
    {"node_id": "decision_goal", "label_zh": "决策目标", "status": "missing", "evidence_zh": "原文只说“分析”，没有说明支持什么决定。", "gap_zh": "结论深度和推荐方向无法收敛。"},
    {"node_id": "comparison_objects", "label_zh": "对比对象", "status": "complete", "evidence_zh": "明确写了 A 和 B。", "gap_zh": "—"},
    {"node_id": "evidence_sources", "label_zh": "依据材料", "status": "missing", "evidence_zh": "未指定官网、报价、用户数据或其他材料。", "gap_zh": "模型可能依赖泛化知识或自行补事实。"},
    {"node_id": "comparison_dimensions", "label_zh": "对比维度", "status": "missing", "evidence_zh": "未说明功能、价格、客户或其他统一维度。", "gap_zh": "两个对象可能被按不同口径描述。"},
    {"node_id": "audience_use_case", "label_zh": "使用场景", "status": "missing", "evidence_zh": "未说明读者和会议场景。", "gap_zh": "无法判断表达深度。"},
    {"node_id": "output_contract", "label_zh": "输出结构", "status": "partial", "evidence_zh": "要求“写”，但没有结构和长度。", "gap_zh": "交付形式仍然随机。"},
    {"node_id": "acceptance_criteria", "label_zh": "可用标准", "status": "missing", "evidence_zh": "“专业一点”无法检查。", "gap_zh": "缺少事实来源和可用标准。"}
  ],
  "radar_scores": {"task_goal": 25, "input_evidence": 0, "context_boundaries": 0, "output_contract": 50, "acceptance_stability": 0},
  "total_score": 15,
  "score_band_zh": "定义不足",
  "priorities": [
    "先明确这次对比要支持什么业务决定。",
    "提供可用材料，并指定统一对比维度。",
    "定义输出结构和事实核验规则。"
  ]
}
